<?xml version="1.0" encoding="UTF-8"?>
<xs:schema xmlns:xs="http://www.w3.org/2001/XMLSchema"
	targetNamespace="http://www.microsoft.com" xmlns="http://www.microsoft.com"
	elementFormDefault="qualified">
	<xs:element name="persons">
		<xs:complexType>
			<xs:sequence>
				<xs:element name="person" maxOccurs="unbounded">
					<xs:complexType>
						<xs:sequence>
							<xs:element name="firstname" type="xs:string" />
							<xs:element name="lastname" type="xs:string" />
							<xs:any minOccurs="0" />
						</xs:sequence>
					</xs:complexType>
				</xs:element>
			</xs:sequence>
		</xs:complexType>
	</xs:element>
</xs:schema>
